,id,text,educational_value_labels,annotator_ids,problematic_content_label_present,problematic_content_label_agreement,language_names,language_code,encoding,disagreement
353,62e42965-d0e9-40ff-8692-36795d7e3658,"Står du pludseligt og mangler penge til noget vigtigt, så kan det være nødvendigt med et online lån. Bankerne er nemlig meget restriktive med at låne penge ud, og samtidig kan processen med et banklån være langvarig.
Her i artiklen har vi kigget nærmere på det store marked for online lån. Vi har lavet en guide til hvordan du vælger det bedste og billigste lån, som passer til netop dine forhold. Hele markedet med lån på nettet kan nemlig være svært at overskue, men vi giver nogle tips og tricks her i artiklen. Du kan få mere info her: https://laanweb.dk/laan-500/
I takt med de øgede konkurrence på markedet for lån på nettet, så er udbyderne også blevet nødt til at sænke priserne. Ellers går kunderne nemlig bare hen til en konkurrent, og får lånet billigere her.
Dette skal du udnytte, når du skal have et online lån. Det er derfor vigtigt, at du husker at få et overblik over markedet, og ikke bare vælger det første og bedste lån du har hørt om i radioen.
Der er mange penge at spare, hvis du sætter din ind i tingene først. Samtidig er det altid godt at have styr på økonomien, så undgår du måske at skulle låne penge en anden gang.
Den øgede konkurrence går også, at du kan forhandle pris på mange af lånene. Udbyderne tjener nemlig gode penge på at låne penge ud, så de er ofte villige til at skære lidt af prisen.
Dette er især aktuelt, hvis de skønner at du godt kan betale lånet tilbage igen. Tag derfor kontakt til dem og forklar om dine økonomiske forhold og planer for lånet, så kan de se at du tænker fornuftigt og har styr på din økonomi.
Vi kan nemlig alle komme ud for at skulle låne penge, da udgifterne har det med at komme på de værst mulige tidspunkter. Så længe der er en god grund til lånet, og du ellers har styr på dit liv, så kan der være mange penge sparet ved at forhandle dig frem til et billigere lån.Read More
Står du overfor at skulle give en gave, til en du holder af? Det kan enten være i forbindelse med vedkommendes fødselsdag, i forbindelse med jul, bryllup eller en helt fjerde begivenhed.
Hvad enten du skal forære en gave af den ene eller anden grund, så er det en mere eller mindre afgørende forudsætning, at du pakker gaven flot ind. For en smukt indpakket gave gør den som regel bare ekstra god, og får vedkommende til at glæde sig endnu mere til at se, hvad der er ""på den anden side"" af indpakningen.
Til den smukke gaveindpakning kan du benytte flotte gaveband, der let og effektivt kan være med til at ""pifte"" indpakningen lidt ekstra op end normalt.
Der findes et uendeligt antal af muligheder, når du skal vælge det rette gaveband. Klik her og find ud af, hvilke farver og typer, der bl.a. findes på markedet lige nu.
Når du skal vælge det rette gaveband, så kan du f.eks. vurdere type ud fra, om gaven skal gives til en dreng eller en pige. Er der tale om en drengegave, så kan en blå eller grøn farve være en rigtig god idé. Er det i stedet en pige, som du skal pakke en gave ind til, så kan en rød eller pink farve være en fordel.
Til både drenge og piger kan farver som gul, sort, hvid, sølv og guld bl.a. med fordel benyttes.
Noget andet, som du kan tage med i dine overvejelser, når du skal vælge det rette gaveband, så er det, hvilket gavepapir du skal bruge. Er der f.eks. nogle gule mønstre i papiret, så vil det se enormt smukt ud med et gult bånd.
På samme måde kan du mikse og matche papir og bånd på en måde, så det giver en smuk og harmonisk indpakning at se på.
Og tro det eller lad være, sådanne bånd behøver ikke at være lavet af papir. Du kan også købe båndene i silke eller et lignende materiale. På den måde kan du pakke gaver ind og samtidig give dem et endnu mere eksklusivt udtryk end som så. Silkebånd er den ideelle måde at pifte en gaveindpakning op på. Har du f.eks. ikke lige fået købt noget flot gavepapir, så kan selv en avispapirindpakket gave få et eksklusivt præg med et bredt silkebånd.
Gaveband kan bruges til meget mere end blot at pakke gaver ind med. Skal du f.eks. pynte huset op til fødselsdagsfest, så kan du med fordel hænge balloner i loftet ved hjælp af fine bånd. Gør ballonerne mere iøjefaldende ved at hænge dem op i guld- eller sølvbånd.
På samme måde kan du også benytte et smukt rødt bånd til at hænge dine julekugler op med eller måske til at pifte nytårsbordet endnu mere op end normalt.
Således er der endeløse mange muligheder til, hvad man kan bruge gaveband til. Det handler blot om at slippe fantasien løs.
Read More
Når man står overfor en større renovering af ens bolig, er der ingen tvivl om, at man hurtigt kan komme af med en del penge. Ofte vil man møde uforudsete forhindringer, der vil ende med at blive de dyreste dele af processen. Det er selvfølgelig tydeligt, at du får noget ud af det i den anden ende, men det kan fortsat virke utrolig irriterende at skulle bruge så mange penge på småting såsom nye håndtag eller paneler.
Derfor kan man altså også have tendens til at tage sagen lidt i egen hånd, da det umiddelbart kan virke billigere. Det kan både være fordi, at man ikke behøver at betale løn til en håndværker, men derudover har man muligheden for at lave den billigste og mest lavpraktiske løsning, der er. Det kan virke som en god måde at spare lidt penge på budgettet, så man kan få råd til andre ting,
Der er selvfølgelig nogle områder, hvor det kan lade sig gøre at gøre tingene selv. Dog er der samtidig også en lang række områder, hvor det er bedre, hvis man lader nogle professionelle tage sig af opgaven. Dette gælder eksempelvis, hvis man kigger på elektriske opgaver. Der er mange, der har en lille idé om, hvordan man beskæftiger sig med elektronik, men det kan fortsat være en dårlig idé at tage opgaven i egen hånd. Det kan nemlig gå grueligt galt, hvis ikke tingene bliver gjort ordentligt, og udover at en kortslutning og mulig brandfare selvfølgelig er mulige, vil man også ende med at skulle betale endnu mere, når det hele brænder sammen. Derfor er det rent økonomisk også smart, hvis man hiver fat i en dygtig elinstallatør i Randers, der kan tage sig af det elektriske arbejde. På den måde sikrer man sig også de bedste løsninger.
Mulighederne for at finde en god elektriker i Randers er mange. Der findes nemlig utrolig mange, der beskæftiger sig med dette erhverv, og som kunde har man altså masser at vælge imellem. Dog kan dette også gøre det svært at beslutte sig. Det vigtigste er først og fremmest, at man kortlægger de opgaver, der skal løses. Man kan nemlig opleve at forskellige elektrikere har særlige fokusområder, og derfor må man vælge en elektriker, der fokuserer på det, som man skal have ordnet. Derudover er det også en kæmpe fordel, hvis man finder en elektriker, der kan hjælpe en med at finde den bedst mulige løsning. Som husejer kan man have nogle rimelig klare idéer om, hvordan tingene skal forløbe, men dette behøver ikke betyde, at dette er den bedste løsning. Derfor kan det også være godt, hvis man finder en, der kan give lidt råd og vejledning med på vejen.
Der er ingen tvivl om, at det selvfølgelig har stor betydning, at dem der skal udføre det elektriske arbejde er kompetente og dygtige, så man får et resultat af høj kvalitet. Dog kan man heller ikke kom udenom, at prisen selvfølgelig har en betydning. Som det allerede er nævnt, kan folk have tendens til at ville gøre tingene selv, blot så de kan spare penge. Derfor må man også være kritisk overfor prisen, når man går på udkig efter en elinstallatør. Dog kan det være svært at vide den endelige pris, da intet hus er det samme, og der vil være forskellige ting, der skal til, for at man kan nå resultatet. Hos knud-jorgensen.dk kan man ringe ind og få et uforpligtende tilbud. På den måde kan man få en klar idé om, hvad man kan få for prisen, og dermed også lettere sammenligne.Read More
Big data har været et af årtusindets største buzzwords indtil videre. Computere og internettet har skabt en overflod af data i virksomheder i hele verden, og det er en lang række virksomheder der ikke har formået at få omsat disse data til brugbar information, som ledelsen kan bruge til at træffe beslutninger. Det er problematisk, da det er big datas største force.
Big data er kæmpe mængder af data på alt i virksomhedens omverden og interne processer, og kan som sagt understøtte ledelsen beslutninger, hvis de bliver kategoriseret og analyseret tilstrækkeligt.
Som eksempel på disse data i en traditionel industri kan være i hvilke perioder folk køber mest øl, hvor dataene kunne fortælle at ølsalget er størst på dage med godt vejr. Ledelsen ville derfor kunne kigge på dette og komme frem til at produktionen eller lagrene skal øges, såfremt vejrudsigten ser lovende ud.
I serviceindustrien kan data også benyttes, eksempelvis i forhold til kundeservice, hvor man kan tage tid på hvor lang tid en opgave tager, og hvornår der er størst pres på telefonerne. Man vil derefter kunne flytte kapacitet fra dage hvor der er meget stille til dage hvor der er meget aktivitet.
At få styr på sine data kan vise sig at være en udfordring, men dette kan Automize.dk hjælpe med.
Automize.dk er IT-konsulenter. De hjælper med at strømline små såvel som store virksomheders processer, så de har mulighed for at agere agilt på markedet, og bruge deres data i ledelsesmæssigt perspektiv.
Deres primære fokus ved strømlining af processer er gennem automatisering og optimering af trivielle og monotone opgaver, som der findes utallige af i de danske virksomheder. Det kan være, at man mailer korrespondancer frem og tilbage internt i virksomheden, og kundernes forespørgsler er længe undervejs.
Ved at rådføre sig hos Automize.dk kan de foreslå en sammenhængende IT-løsning der gør, at virksomhedens silotænkning bliver spredt ud, og man derved kan arbejde med de samme informationer uden at hente dem fra forskellige steder i systemerne.
Det vil give en øget værdi for virksomheden som vil kunne spare oceaner af tid på trivielle opgaver, og i stedet fokusere på noget der skaber værdi.
Værdien skabes også hos kunderne, som får deres forespørgsler hurtigere behandlet, og generelt får en bedre brugeroplevelse, som gør at de er mere tilbøjelige til at vælge det samme firma igen.Read More
Kalvø er en stor ø, der er 17 hektar. Øen er i nærheden af Aabenraa og Haderslev. Øen er en del af Aabenraa kommune. En ø med masser af smuk natur. Hvis du er til natur på den gode og barske måde, så må du tage et kig forbi Kalvø Badehotel. Således kan du både nyde enten en kold morgen dykker eller en lun morgen dykker – alt afhængig af årstiden. Når du endelig er her, kan du ligeså godt spise kalvø steak. Når man er på ferie eller forlænget weekend ophold, kan man ligeså godt passe godt på sig selv og fylde maven med lækkert mad. Her får du en steak tilberedt at friske råvarer. Der gås på ingen måder på kompromis med kvaliteten.
Der er så meget liv på Kalvø. Alt fra fuglelivet, krabberne i vandkanten, stenørkenen og sejlbådenes master. Det er området for dig, der elsker naturen med dens varme sol og dens barske vind. Det er et ø for dig der godt kan lide at være ude med naturen og dig der gerne vil give det videre til dine børn. Her på Kalvø Badehotel bliver alt tilberedt for bunden – med de bedste råvarer. Alt fra de lækre kager, morgenbrødet, den røgede fisk, saucen til isen. Der tages udgangspunkt i de friske lokale råvarer. Kalvø Steak er klart besøget værd.
Tag dit firma med til en anderledes weekend ophold. Slap af sammen og lad på til de kommende arbejdsuger. Mærk naturen og slip al dit stress ud. Det er vigtigt at du også husker at slappe af og hviler i hele din krop. Din hjerne har også brug for andet end at arbejde – frisk luft, en gåtur ved vandet eller en lille vandretur i skoven. Der er mange muligheder – kom glad.Read More
Hvis man leder efter en ny bil, så er der lige pludselig rigtig mange ting, som man skal tage stilling til. Det kan nemlig være, at man overvejer, om man skal købe den helt samme model som før eller man rigtig gerne bare vil købe en ny model. Det kan også være, at man overvejer, om man måske skulle købe en helt ny bil. Det er så i sådan en situation, hvor man skal komme til fornuft. Hvis man skal have en ny bil, så er det nemlig helt klart en fordel, hvis man køber en brugt bil i stedet for. Så kan man også være sikker på, at man får det hele meget billigere.
Man kan godt have nogle fordomme, hvor man bare tænker, at hvis man køber en brugt bil, så får man slet ikke en ordentlig bil og at den egentlig bare er ulækker på indersiden. Det er dog ikke noget, som man møder særlig ofte. Det handler nemlig bare i høj grad om, at man er kræsen, når det kommer til selveste bilen. Når man begynder at give en anelse plads til andre idéer og brugte biler, så kan man lige pludselig få langt større muligheder, fordi det ikke er lige så dyrt som at købe en helt ny bil. Det er nemlig ikke kun noget, der er godt for ens egen økonomi, men det er også bedre, hvis man ikke skal til at bygge en ny bil.
Når man vælger en brugt bil i stedet for en helt ny bil, så vil man nok også blive klar over, at man har lidt større muligheder, når det kommer til biler. Det kan nemlig ske, at der er en bestemt familiefar, der virkelig bare ønsker sig en helt bestemt stationcar, men den kan ikke købes som ny. Det er så der, hvor man har muligheden for at søge rundt på hele internettet for at finde den helt rigtige model. Der er helt generelt også bare flere flotte biler. Besøg autowelt.dk for mere information.
Read More
Når man er leder, så har man et stort ansvar overfor både et firmas kunder, men også de medarbejdere, som man møder med på en daglig basis. Det kan da være svært at vide, hvordan man som leder gør det, og det kan også være en udfordring at forstå andre ledere, når de har ansvarsområder, som er meget forskellige. Dette kan give flere problemer, idet nogle ledere måske vil arbejde sammen forskelligt med forskellige medarbejdere og dermed opnå forskellige resultater, hvilket til sidst kan give tvivlsomme forretningsmæssige resultater.
Derfor bør du tænker over, om du som leder måske skal deltage i en lederevaluering. Lederevalueringer er simple i deres koncept. En lederevaluering er egentligt bare en måde, hvorpå man kan måle forskellige aspekter af en leder og forstå, hvordan de handler, hvorfor de handler på disse måder, og hvilke resultater, som disse handlinger kan give. Når en lederevaluering udføres, så har man en leder, der i teorien skal ""testes"" på. Herefter vil man så spørge en række af de mennesker, som kender lederen i forskellige miljøer. Her vil man spørge nogle af de medarbejdere, som lederen har ansvar for, men man vil også optage udsagn fra andre ledere og sidestillede. Dette kan derfor give et meget nøjagtigt billede af, hvem du er som leder, og hvordan du agerer sidestillet med kolleger. Med denne form for lederevaluering, så får du altså et fuldendt overblik over, hvad du gør som leder, og hvad du også kunne gøre eksempelvis her: http://www.peopletestsystems.com/certificering/.
Der er en række grunde til at blive evalueret som leder, men en af de vigtigste skal findes i, at man som leder har ansvar for andre medarbejdere. Når dette er tilfældet, så står man ofte for at skulle rekruttere medarbejdere til sine projekter, hvilket ofte kan være en svær proces. Når man derfor har mulighed for at kaste lys over forskellige opfattelser og tolkninger af lederens arbejde, så kan det altså være meget lettere at finde ud af, hvordan man skal behandle og arbejde sammen med sine medarbejdere. Dette giver et mere effektivt arbejdsmiljø, hvor I ikke kun kan få udført det bedst mulige arbejde, men samtidig gøre dette, så medarbejderne oplever jobbet som fyldestgørende. På denne måde skabes et bedre arbejdsmiljø, hvor alle kan få lov til at udføre deres bedste arbejde.Read More
Et webbureau kan hjælpe dig med mange forskellige ting vedrørende din hjemmeside. Måske har dit firma slet ikke en hjemmeside og skal bruge en, men du ved måske ikke helt hvordan det skal gribes an. Ved at tage kontakt til et webbureau kan du blandt andet få hjælp til hvordan din hjemmeside bliver mere synlig på nettet. Desuden kan en hjemmeside vise hvem man er som firma. Når du kontakter webbureauet kan de hjælpe dig til den bedste synlighed på nettet, således at dit firma repræsenteres online som du ønsker det. Det kan være ved at vælge det rigtige design til hjemmesiden både i form af udseende men også brugervenlighed. En hjemmeside, der er svær at navigere gør at kunden eller brugeren hurtigt forlader den igen. Det samme gælder hvis hjemmesiden ikke er mobilvenlig. Et webbureau kan blandt andet hjælpe dig med at analysere kundernes flow og brug af din hjemmeside.
Gennem forskellige analytiske værktøjer er det blandt andet muligt for webbureauet at fastslå kundens sti gennem din hjemmeside, og hvilken vej de er kommet ind på den. Den kan for eksempel være at folk er kommet til hjemmesiden ved at have klikket på en online reklame eller blot er gået direkte ved at skrive hjemmesidens URL i proceslinjen. Hvis du har en online shop kan et webbureau hjælpe dig til at analyserer hvornår kunderne køber noget, eller om de tit bare falder fra ved kassen. Hvis statistikken viser at mange falder fra ved kassen eller lige inden de når til kassen, kan de være at der er noget på hjemmesiden, der simpelthen ikke er brugervenligt nok. Webbureauet kan hjælpe dig til at analyser kunders adfærd på hjemmesiden samt optimere den så du får mest ud af den. Besøg https://bestsite.dk/ for at læse mere.Read More
Der et utroligt dyrt med maskinnedbrud i din virksomhed, hvorfor der skal gøres alt for at forebygge dette. Med Bently Nevada kan du undgå mange af disse dyre nedbrud, da det smarte system monitere for bl.a. vibrationer og andre fejlkilder.
På denne måde kan Bently Nevada afhjælpe flere potentielle fejl, som ellers kunne koste virksomheden rigtigt mange penge. Man kan derfor se investeringen i dette moniteringsudstyr som en forsikring, og den kan hurtigt være tjent ind igen.
Du kan læse mere om Bently Nevada via følgende link: nh-technology.dk
Det smarte system overvåger jeres maskiner via en masse tekniske løsninger, som f.eks. monitering af uønskede vibrationer og meget andet.
Systemer kan overvåge den elektriske tilstand på motorerne på jeres maskiner, så det kan tjekke hvis der begynder at blive uønsket belastning eller fejl.
Systemet kan derfor både være med til at forebygge fejl på kritisk materiel, men det kan også bruges til at optimere jeres maskiner. På denne måde giver det lavere belastninger og bedre ydeevne, hvis det hele bliver opsat korrekt på baggrund af moniteringen.
Samtidig er Bently Nevada en prisvenlig løsning til monitering af de vigtige maskiner. På denne måde får man meget sikkerhed for pengene, og det giver tryghed i virksomheden.
Nedbrud kommer næsten altid på de værst tænkelige tidspunkter, så det er rart at eliminere denne risiko, eller i hvert fald formindske den.
Alt går samtidig i stå, hvis virksomhedens kritiske maskiner går ned. Det kan medføre en hel perlerække af effekter, så virksomheden nærmest bliver lammet.
Bently Nevada er bare en af de mange smarte og moderne løsninger, som gør industrien mere effektiv. De seneste år er der kommet en masse løsninger, som både forbedre produktionsevne og stabilitet.
De virksomheder, som gør brug af disse teknologiske muligheder opnår ofte de bedste resultater, da de forstår at udnytte potentialet i teknologien.
Udviklingen går samtidig rigtigt hurtigt, så det er vigtigt med nogle interne eller eksterne eksperter, som kan rådgive virksomheden om de teknologiske muligheder inden for deres branche.
I tilfældet her med Bently Nevada, så kan man kontakte firmaet og høre om mulighederne, men det er også vigtigt med uvildige eksperter.
Man skal huske på, at de forskellige virksomheder vil sælge deres produkter, men der kan også være andre gode løsninger. Undersøg derfor altid markedet godt, inden der investeres i tekniske og komplicerede løsninger.Read More
Leder du efter et godt sted til dækservice, så er der flere ting, som du skal være opmærksom på. For det første er det vigtigt at vælge et sted, hvor du har tillid til arbejdet.
Heldigvis er der mange gode værksteder, hvor de har specialiseret sig i dækservice. Det kan dog godt betale sig at kigge lidt rundt, så du ikke vælger det første og bedste sted til at få ordnet din bils dæk.
Der er nemlig forskel på både priser og kvalitet, så din bil fortjener, at du kigger dig lidt for først. Du kan læse nogle anmeldelser på nettet, da man næsten kan finde anmeldelser af alt på nettet. Så kan du høre om andre brugeres erfaring med netop dette sted til dækservice.
Det kan også være en god ide at indhente flere tilbud på dækservice, så du på den måde er sikret den billigste pris. Du kan hurtigt ringe rundt til nogle forskellige værksteder, og få et prisoverslag på arbejdet.
Herefter kan du vælge det bedste tilbud, så du sparer flest penge. Du får ofte en rigtig god timeløn, hvis du bruger lidt tid på at indhente tilbud, om det så er til den ene eller anden ting.
Det kan godt betale sig, og du kan ligeså godt gøre det til en vane med det samme, der er mange penge sparet over et helt liv, hvis du lærer at forhandle om prisen og indhente tilbud.
Det kan ofte betale sig at vælge lokale virksomheder, da de lever af de lokale kunder. De vil derfor gøre rigtigt meget for en god service og pris, når de hører, at du er fra samme område.
De ved nemlig godt, hvordan du fortæller om arbejdet til alle du kender i nabolaget. Sørg derfor for at fortæl dem, at du er fra lokalområdet.
Bor du i nabolaget omkring Hadsund og Randers, så vælg et dækservice i dette område. Og hvis de ikke matcher de tilbud, som du allerede har indhentet ved andre steder, så skal du forhandle med dem om prisen..
Godt sted til dækservice i dette område: https://www.hcautocenter.dk/daekservice/
Kan de andre steder tjene penge på arbejdet, så kan dit lokale værksted også tjene penge på denne pris. Og dermed har du noget at forhandle om, og du sidder med nogle gode kort på hånden, da du har de andre tilbud, som du kan benytte dig af.
Read More
Da mobilen kom ud og alle begyndte at ringe og SMS'e var det meget udbredt at have et telefoncover. Det var udelukkende en æstetisk ting. For mange år siden da man begyndte at have mobil brugte man udelukkende telefoncovers af æstetiske årsager. Man købte dem så det så pænt ud når man stod med sin mobil. I dag er det anderledes. For nu tænker man langt mere på funktionalitet end tidligere. Man tænker på, at mobilen skal holde og det er noget man kan gøre med telefoncovers. Der findes mange forskellige og en af typerne man kan bruge er for eksempel TPU covers. Derudover finder du også flip-covers, og udover det er der også mange andre covers.
Mange tænker, at hvis noget skal være meget praktisk og funktionelt, så er det ikke muligt, at det samtidig er pænt. Det er dog ikke rigtigt for de to ting kan sagtens gælde samtidig. For eksempel er det ikke svært at finde et telefoncover der er holdbart. De fleste flip covers er for eksempel yderst holdbare. Det er de fordi, at du har en hel flipside, som du kan tage over skærmen. På den måde er skærmen så godt beskyttet, som du kan forestille dig. Der er mange, der i lang tid har sværget til netop denne type af cover. Får du selv sådan et cover i hænderne vil du vide hvorfor. Det er meget tydeligt hvordan mobilen beskyttes og du får næsten lyst til at kaste lidt med din mobil bare for at se hvor meget den kan holde til.
Dog er det ikke kun de praktiske aspekter, som du kan nyde ved dit flip cover og din mobil. Du kan nemlig også nyde, at det ser rigtig pænt ud. Det er naturligvis meget afhængigt af hvilken type cover du vælger, da de svinger meget i hvor smukke de er. Du kan for eksempel vælge et telefoncover, som er rødt i en skinnende farve. Det er meget unikt og det er der stor set ikke andre der har. Således kan du have din mobil liggende på bordet uden andre prøver at tage den. Udover at vælge et godt telefoncover til din mobil er der også andre ting du kan gøre for at beskytte den. Du kan nemlig overveje at købe beskyttelsesglas. Det er et tyndt lag glas, som du sætter oven på skærmen. Det er med til at beskytte din mobil rigtig meget og sammen med et godt telefoncover kan din mobil klare det hele.
Der kommer flere og flere forskellige materialer på markedet og mange af dem er helt nye og aldrig set før. Blandt andet gælder det TPU, som er noget man ofte ser på covers. Det er et materiale, som er meget fleksibelt. Du kan faktisk bevæge det med fingrene uden det går i stykker. Det meget overraskende er så, at det er meget stærkt. Det får du at se når du bruger det som et telefoncover. For så kan du tabe din mobil uden der sker noget. Gode og billige TPU covers er noget, som du kan finde i de fleste forhandlere af telefoncovers.
Meget ofte er TPU telefoncovers lavet i et meget blødt og anonymt design. De gør altså ikke så meget væsen af sig. Ikke desto mindre vil man dog ofte lægge mærke til dit telefoncover, hvis det er lavet af TPU. Det vil især ske hvis du vælger at have et cover i en særlig markant farve. Et telefoncover i pink eller lilla vil for eksempel være noget, som de fleste lægger mærke til.Read More",['Excellent'],"['a0585a5c-b72f-4c3a-a2a3-17e8e0b4ea4f'
 '85ac8d54-89c5-4473-95c4-797366f03cd0'
 '14af86f2-cf7e-4ad3-a002-1e6ece983846']",False,1.0,dan_Latn,dan_Latn,"[0, 1, 0, 0, 1]",True
