,id,text,educational_value_labels,annotator_ids,problematic_content_label_present,problematic_content_label_agreement,language_names,language_code,encoding,disagreement
108,e5ae24bd-032e-4a1a-b4ca-2c0004e17b6b,"Det danske mobilmærke Lumigon er klar med en shop-in-shop butik i samarbejde med Phoneium. Det oplyser Lumigon på deres Facebook-side.
I butikken vil du kunne opleve Lumigons seneste smartphone, Lumigon T3, samt alle producentens headsets.
Butikken er placeret i Farum på bytorvet, og udover en demonstration af alle produkterne, står personalet også klar til hjælp med de spørgsmål, du måtte have.
Lumigon håber selvfølgelig på, at denne shop-in-shop vil hjælpe til at udbrede deres kendskab i landet, men om det reelt vil virke, ja det er svært at sige.
Ikke desto mindre er Lumigon nu klar i butikken, og du kan finde den her:
Phoneium, Farum Bytorv 41, 3520 Farum
Læs mere om butikken på Lumigons Facebook-side her.",['None'],"['95e4f810-6fe7-4bbd-8be6-a11b0d069c11'
 'a0585a5c-b72f-4c3a-a2a3-17e8e0b4ea4f'
 '85ac8d54-89c5-4473-95c4-797366f03cd0']",False,1.0,dan_Latn,dan_Latn,"[1, 0, 1, 0, 0]",True
110,7650f723-61e7-4869-af3f-a289880a4bf2,"Anmeldelser (4)
|Decanter||


|Timatkin.com||


|Timatkin.com||Wines of the year Category: Hvid|
|Robert Parker||


Remelluri Rioja Blanco
Remelluris marker er gennemgående kalkholdige og derfor velegnede til at dyrke grønne druer i topkvalitet. Hvidvinen fra Remelluri sammensættes af en veritabel buket af karakterfulde druesorter; Viognier, Moscatel, Garnacha Blanca, Chardonnay, Sauvignon Blanc, Rousanne, Marsanne og Petit Courbut. Vinen fremstår strågylden og byder på en bouquet af æble, pære og melon. Smagen er indsmigrende og silkeagtig fine nuancer af blomster, krydderier og mineraler.
|Varenummer||55251116|
|Type||Hvidvin|
|Flaskestørrelse||Helflaske 75 cl.|
|Leveres i||TRÆ 6|
|Producent||Remelluri|
|Land||Spanien|
|Område||Rioja|
|Druesorter||Viognier, Moscatel, Garnaccha Blanca, Chardonnay, Sauvignon Blanc, Rousanne, Marsanne og Petit Courbut.|
|Anbefalet til||Aperitif, fisk, skaldyr, friske ostetyper.|
|Drikkemoden||Ved frigivelse og op til 10 år fra høståret.|
|Fadlagring||17 mdr. på franske egefade.|
|Økologisk||Ja|
- 94P - Decanter:"" A modern classic: a nine-variety white Rioja blend which, apart from the local varieties, also has some southern French ingredients. An original, which gets ever better. Lovely aromatics, and the underlying memory is freshness, overlaid by sweet spices, ripe pear and apple fruits, with a very long finish.""
- 94P - Robert Parker: Issue 243 End of June 2019:"" 2016 was a more challenging but remarkably cooler year, and the 2016 Blanco shows great freshness and contained ripeness, as the grapes ripened slowly and late. The wine had less alcohol and more acidity than the 2015 I tasted next to it. It has to be the finest vintage for the white produced here, still young and undeveloped. It's the palate where the wine is vibrant and lively, very fresh, harmonious and long. I tasted a 2007 next to this, and it showed perfect for drinking, so that can give you an idea of how this wine can develop for a good ten years after the harvest. 10,094 bottles produced. It was bottled in June 2018. It has to be one of the finest whites produced at Remelluri.""
- 95P - Tim atkin 2020:"" After a slight dip in form in the heat of the 2015 vintage, this highly original, groundbreaking white is back on form in cooler 2016. Made with nine local and international varieties, most of them planted in the higher part of the estate, this is waxy and herbal with notes of peach, honeysuckle, citrus, pear and aromatic spices. 2020-24""
- Druesorter: Viognier, Moscatel, Garnaccha Blanca, Chardonnay, Sauvignon Blanc, Rousanne, Marsanne og Petit Courbut.
- Fadlagring: 17 mdr. på franske egefade.
- Drikkemoden: Ved frigivelse og op til 10 år fra høståret.
- Anbefales til: Aperitif, fisk, skaldyr, friske ostetyper.
Remelluri - Slotsaftappede vine fra Riojas ældste vingård
I 1967 grundlagde familien Rodriguez den moderne version af Remelluri, det højest beliggende vinslot i Rioja. Vinslottet, der kan føre sin historie tilbage til 1596 og dermed er Riojas ældste, blev det første i Rioja, som udelukkende fremstillede slotsaftappede vine på druer fra egne marker; et princip, som Rodriguez-familien havde tilegnet sig fra Cru Classé-slottene i Bordeaux. På denne måde sikrede de sig fuld kontrol fra vinstok til aftapning, og dermed kunne de fremstille Rioja på et hidtil ukendt kvalitetsniveau.
Telmo Rodriguez - ""enfant terrible"" vender hjem
Telmo Rodriguez var i nogle år familiens ""fortabte søn"" og skabte sig et navn i eget firma som en af spaniens ubestridt bedste winemakere med et unik blik for at skabe dybt originale vine til overkommelige priser, men i 2010 bad familien Telmo Rodriguez om at overtage driften af familiens vinslot. Telmos ""lærepladser"" tæller blandt andet Petrus i Pomerol, Guigal i Rhône, Cos d'Estournel i Saint-Estèphe og Dominus i Californien. Telmos filosofi har gjort at Remelluris marker i dag er under omlægning til økologisk dyrkning, og det er hans hensigt at følge op med en certificeret biodynamisk produktion. Telmo satser også på at eksportere vinene og ikke kun satse på det spanske marked, der desværre er i dyb, økonomisk krise. I 2018 blev vinene fra Spanien opdelt i Cru, som man kender det fra Frankrig, af Tim Atkin. I den forbindelse blev Remelluri kategoriseret som en 1. Cru.",['Good'],"['a0585a5c-b72f-4c3a-a2a3-17e8e0b4ea4f'
 '85ac8d54-89c5-4473-95c4-797366f03cd0'
 'ec88c396-7fa8-4746-a92a-a91784e57b7b']",False,1.0,dan_Latn,dan_Latn,"[1, 0, 0, 1, 0]",True
125,993e0900-7469-4e9a-bbe2-0544cf0874e8,"Arrangementet begynder kl. 17.30, og ca. kl. 18 er der foredrag med dyrlæge Nicolaj Jarløv under emnet nye måder at diagnosticere rideheste på og ridehestens problemstillinger ud fra et hestevelfærds synspunkt.
Herefter er der middag. Under middagen er der videoklip og billeder fra tidligere OL, kommenteret af OL dommer Susanne Baarup. Der vil være indlæg om OL-forberedelserne med chef d´equipe Kimi Nielsen og Susanne Baarup.
Læs mere hos Dressurens Venner.
H.K.H. prinsesse Benedikte vil være tilstede under FEI World Cup stævnet på Vilhlmsborg denne weekend. I sin egenskab af formand for Dressurens Venner vil prinsessen også løfte sløret for dette års modtager af Lis Hartels mindepris
Finalen i Dressurens Venner Cup er netop afgjort hos Hovgaard Rideklub i dag, og det blev Årslev/ Sdr. Nærå Rideklub, som red sig til en flot sejr
I dag blev det afviklet en afdeling i Dressurens Venner Cup hos Slangerup-Lynge Rideklub, og det blev holdet fra Riders Cup det tog sejren. Laura Holte Nielsen, som var en af rytterne på holdet har fortalt os lidt om dagens resultat
Ved World Breeding Federations for Sport Horses' årsmøde med generalforsamling, der i år finder sted i Saumur i Frankrig, er formanden for organisationen igennem 20 år, Jan Pedersen, netop blevet genvalgt som formand
Auktionen i forbindelse med kåringen i Oldenburger Pferdezuchtverband i Vechta er netop afsluttet, og dyreste hammerslag faldt på en dressurpræmiehingst e. For Dance, som blev solgt for over 2 millioner danske kroner
FEI har meddelt Dansk Ride Forbund, at militaryrytter Maibrit Laustsens hest Lillifee Ajk er testet positiv i en dopingtest foretaget ved UVM i Frankrig – foder er under mistanke
Den 8-årige hingst Ferrari OLD har forladt Helgstrand Dressage, og går nu en spændende fremtid i møde hos den tyske dressurstald Gestüt Ammerland
En lovende ung 16-årig rytter som havde verden for sine fødder, tog sit eget liv efter et mindre skænderi med sin mor. En tragisk slutning på et alt for kort liv, og en død, som har fået pigens mor til at starte en indsamling",['None'],"['a0585a5c-b72f-4c3a-a2a3-17e8e0b4ea4f'
 '85ac8d54-89c5-4473-95c4-797366f03cd0'
 '14af86f2-cf7e-4ad3-a002-1e6ece983846']",False,1.0,dan_Latn,dan_Latn,"[1, 1, 1, 0, 0]",True
169,a0a0e28d-ceb6-42af-8c62-ee3aa01ae0a7,"Annonce
Det er vigtigt at vide, hvad en LEI-kode er. Det er nemlig meget vigtigt fordi, at mange virksomheder har brug for lige denne licens i sin forretning. Formålet med en LEI er, at man vil gøre handlen med forskellige værdipapirer og finansielle transaktioner meget mere gennemsigtig. det er godt at de kan blice mere gennemsigtige for at kunne forebygge og stoppe økonomisk svindel. Det kunne blandt andet være svindel som hvidvask af penge, som man prøver at forhindre.
Hvad er en LEI-kode
En LEI er en 20-cifret kode. Den består af både bogstaver og tal. Koden bruges til at identificere virksomheder, som vil lave finansielle transaktioner, samt handle med værdipapirer. Værdipapirer kunne blandt andet være obligationer eller aktier. Så hvis et firma, vil have licens til at udføre disse handler eller transaktioner, så har de brug for en LEI-kode. Alle de enheder, som har noget med aktier eller andre finansielle transaktioner skal besidde en LEI-kode. Enkeltpersoner behøver ikke have en LEI-kode, men det er vigtigt at vide, at alle virksomheder skal have en. Antallet af handler er altså ikke afgørende for, om man behøver en.
Sådan fornyer man en LEI-kode
Man skal sørge for altid at have en gyldig LEI-kode. Koden skal fornyes hvert år. Det kan derfor være smart, når man skal forny den, at man kan få det gjort automatisk. Forny LEI-kode ved at forlænge koden. Man kan vælge x-antal år man vil forny sin kode. Det bliver billigere, jo flere år man køber. Der er mange forskellige udbydere af koderne, det er derfor vigtigt at finde den rigtige udbyder, som passer til virksomhedens behov. Det handler om at finde den udbyder, som har den bedste pris, laveste gebyrer eller måske den bedste service.
Derfor er det vigtigt af have en LEI-kode
Det er vigtigt for firmaer og virksomheder at have en LEI-kode, da de så er registreret og godkendt til at kunne udføre finansielle transaktioner eller handle med værdipapirer. Det er også vigtigt at have det, da LEI er standarden i EU og i mange andre dele af verdenen. Det kan sammenlignes med det danske CVR-register. Formålet med LEI-koder er som sagt, at man vil gøre, handler og finansielle systemer mere gennemsigtige og forhindrer økonomisk svindel såsom hvidvask. Det er derfor vigtigt at anskaffe sig en LEI-kode, da man på den måde er med til at legitimere sin handel, men samtidigt også støtte op om det internationale system.",['Basic'],"['a0585a5c-b72f-4c3a-a2a3-17e8e0b4ea4f'
 '85ac8d54-89c5-4473-95c4-797366f03cd0']",False,1.0,dan_Latn,dan_Latn,"[1, 0, 1, 0, 0]",True
170,58a90423-1c84-4b52-bf65-3efb85f1714f,"Robert hooke Han var en stor videnskabsmand, der bidrog med mange ideer og fremskridt til videnskaben. Han var også en naturfilosof. Han var professor i geometri og landmåler i byen London, England. Han blev anerkendt for sine store bidrag inden for fysik, mikroskopi, biologi og arkitektur. Han opfandt instrumenter såsom alkoholtermometer, hygrometer, vindmåler og andre instrumenter, som udgør en vigtig arv for videnskab og menneskehed.
I dette indlæg rejser vi til fortiden for at lære om biografien og bedrifter, som Robert Hooke gjorde i hele sit liv. Vil du vide vigtigheden af denne videnskabsmand for videnskabens verden? Her forklarer vi alt for dig i detaljer 🙂
Index
Liv og død af Robert Hooke
Han blev født den 18. juli 1635. Han var den sidste af fire søskende, to drenge og to piger. Det siges, at han havde en meget ensom og trist barndom, han led af hyppige hovedpine og mavesmerter, hvilket forhindrede ham i at lege normalt med børn på hans alder. Denne ensomhed som barn fik ham til at lege med stor opfindsomhed og fantasi. Han lavede solur, vandmøller, skibe, der var i stand til at affyre kugler, han tog et messingur fra hinanden og genopbyggede det i træ og fungerede perfekt.
I sin ungdom var Hooke en del af Kor fra Cathedral Church of the Diocese of Oxford (Christ Church College). Denne æra var den, der smed Hooke i hans passion for videnskab. Han var meget interesseret i forskellige bevaringsværker, der blev udført, da han mente, at de var truet af protektoratet.
Møder af høj videnskabelig, filosofisk og intellektuel betydning blev afholdt på Westminster School, så Robert deltog i mange af dem. Mens klassekammerater deltog i legende aktiviteter, fokuserede Hooke på at tjene til livets ophold. Han begyndte at tjene nogle penge som kemisk anatomiassistent. Senere var han laboratorieassistent. På det tidspunkt, 1658, blev konstruktionen af en luftpumpe eller ""machina boyleana"" udført, baseret på Ralph Greatorex, som Hooke betragtede som ""For grov til enhver stor opgave"".
Han havde en stor evne til matematik. Efter hans mange værker blev hans effektivitet anerkendt, og han blev anbefalet til den første stilling som leder af Royal Society of London. Denne stilling krævede at være en stor eksperimentel og professionel videnskabsmand. Robert Hooke afsatte fuld tid til sine projekter.
Endelig døde den 3. marts 1703 i London. Royal Society of London betalte ham en stor hyldest for alle de bedrifter, som vi vil se nedenfor.
opdagelser
Hooke tilbragte en del af sin tid på at arbejde med Boyle og Boyle foreslog en mission for ham, som var at designe og bygge en pumpe, der var i stand til at komprimere luft for at producere et vakuum. De brugte år på at studere gassvidenskaben, indtil de fik det. Hans første opdagelse var luftpumpen.
Med denne pumpe blev luftens elasticitet og de effekter, de har oplevet, oplevet mange gange. Takket være denne pumpe er formlen for gasloven. I denne lov kan det verificeres, hvordan gasens volumen er omvendt proportionalt med det tryk, den har.
Kapillaritet
En anden af hans opdagelser var kapillaritet. Han havde at gøre med lækage af vand og andre væsker gennem de tynde glasrør. I disse eksperimenter blev det opdaget, at den højde, som vandet når til, er relateret til rørets diameter. Dette er i dag kendt som kapillaritet.
Denne opdagelse blev offentliggjort i detaljer i hans værk ""Micrography."" Takket være disse værker var han i stand til at have stillingen som kurator i Royal Society of London.
Celler og celleteori
Takket være mikroskopet opdagede Hooke, at korkpladen havde små polyhedrale hulrum som en bikage. Hvert hulrum kaldte det en celle. Det, han ikke vidste, var den betydning, disse celler ville have i levende væsner.
Og det var, Robert så på døde planteceller i en polygonal form. År senere ville væv af levende væsener blive opdaget takket være dets observation under mikroskopet.
En anden opdagelse var takket være den viden, han havde om organisering af celler. I det XNUMX. århundrede, med den viden, der blev leveret af Robert Hooke, kunne postulaterne i celleteorien udføres:
- Alle levende ting består af celler og deres produkter.
- Celler er enheder af struktur og funktion.
- Alle celler kommer fra allerede eksisterende celler. Dette blev tilføjet i 1858 af Virchow.
I slutningen af dette århundrede har de følgende undersøgelser vist, at celler kan give os både årsagen og oprindelsen til mange sygdomme. Dette betyder, at hvis en person er syg, er det fordi de har celler indeni, som er syge.
Uranus planet
også var ansvarlig for at opdage planeten Uranus. For at gøre dette observerede han kometer og dedikerede sig til at formulere ideer om tyngdekraft. De instrumenter, der var nødvendige for at måle solens og stjernernes bevægelser, blev lavet af ham. Alt dette gav et stort fremskridt til videnskaben og observationen af det ydre rum.
Planetarisk bevægelsesteori
Ikke alene opdagede han planeten Uranus, men han skabte teorien om planetarisk bevægelse. Han var i stand til at formulere det ud fra et mekanikproblem. Han udtrykte principperne om universel tiltrækning, blandt de stærkeste postulater var den, der læser: alle kroppe bevæger sig i en lige linje, medmindre de afbøjes af en eller anden kraft, vil dette få dem til at bevæge sig, enten i form af en cirkel, ellips eller lignelse.
Han bekræftede, at alle kroppe har deres egen tyngdekraft på deres akse eller centrum, og at de igen påvirkes af tyngdekraften i nærliggende himmellegemer. Jo tættere vi er på andre himmellegemer, jo mere påvirker denne tiltrækningskraft os. Forsøgte også at kontrollere det Jorden bevægede sig i en ellipse omkring Solen.
Som du kan se, gjorde Robert Hooke så mange fremskridt inden for videnskab, og hans navn kan ikke glemmes.",['Excellent'],"['95e4f810-6fe7-4bbd-8be6-a11b0d069c11'
 'a0585a5c-b72f-4c3a-a2a3-17e8e0b4ea4f'
 '82197ecd-6d0b-400a-834a-703da28164ae']",False,1.0,dan_Latn,dan_Latn,"[0, 0, 1, 0, 1]",True
202,ba073c54-a0dc-42f7-8ec0-9413d06c6c53,"Der er mange grunde til, at forskellige hjemmesider er blokeret på internettet. Nogle gange blokerer din internetudbyder forskellige sæt websites af tvetydige grunde. Nogle gange blokeres webstederne på grund af lokalitetsrestriktioner, og nogle gange blokerer dit kontor eller universitet internt for at holde dig væk fra distraktioner. Det er ligegyldigt hvad de egentlige årsager ligger bag de blokerede websites, i sidste ende bliver det ret irriterende for brugeren. Specielt, når du virkelig vil bruge hjemmesiden og finde ud af, at den er blokeret uden nogen indlysende årsager.
Så hvordan overgår du de webstedsblokke, der pålægges dig fra din regering eller internetudbyderen? Hvordan bruger du dit yndlingswebsted, når det er blokeret i dit land? Det er ret simpelt. Der er mange forskellige måder at fjerne blokering af enhver blokeret hjemmeside på din computer eller smartphone. I denne artikel skal vi dække alle de forskellige procedurer, der giver dig adgang til enhver blokeret hjemmeside fra hvor som helst i verden.
Forskellige websteder er blokeret eller har begrænsninger i visse lande og områder rundt om i verden. YouTube er forbudt i Pakistan, Twitter / Facebook og stort antal populære websteder er forbudt i Kina. Populære streaming-websteder som Netflix, Hulu Plus, Amazon Prime, Spotify osv. Er kun tilgængelige i visse lande, så hvis du vil have adgang til nogen af De ovennævnte websteder i ikke-støttede lande, så har du brug for en VPN-software, der hjælper dig med at få adgang til disse websteder, selvom de er blokeret i dit område. Nedenfor er der få forskellige metoder til at få adgang til blokerede websites fra hvor som helst i verden.
Til skrivebord eller bærbar computer (Windows PC / Mac)
Hvis du surfer på internettet på din Windows PC / Mac og ønsker at få adgang til blokeret indhold på World Wide Web, så har vi nogle forskellige metoder til dig.
Unblocking Websites i din browser
Denne metode virker perfekt, hvis du bruger enten Google Chrome eller Mozilla Firefox som din daglige browser.
For Google Chrome: Hvis Google Chrome er din foretrukne browser, kan du downloade et proxyudvidelse til din browser, der giver dig adgang til alle blokerede websites på din pc.
- Bare download Browsec eller ZenMate på din Google Chrome browser.
- Når installationen er færdig, kan du klikke på udvidelsesikonet øverst til højre i Chrome og aktivere det.
- Når du er aktiveret, kan du nemt surfe på alle websteder på internettet, selvom de er blokeret.
Til Mozilla Firefox: Mozilla Firefox lader dig også downloade forskellige proxy-tilføjelser for at fjerne blokering af blokerede websteder. Heldigvis er både tilføjelser til ZenMate og Browsec tilgængelige for Mozilla Firefox-browseren.
Download Browsec eller ZenMate på din Firefox Browser.
- Klik på ikonet til tilføjelse i øverste højre hjørne af Firefox for at aktivere det.
- Når tilføjelsen er aktiveret, kan du begynde at gennemse alle de blokerede websites uden besvær.
Fjern blokering af websteder med en VPN
Hvis du bruger udvidelser og tilføjelser på din browser, er ikke din kop te, så behøver du ikke bekymre dig, fordi vi har fået dig dækket. Du kan også installere VPN-software på din Windows-pc for at fjerne blokering af alle websteder på internettet. Der er tusindvis af VPN-software tilgængelige derude, men vi bringer dig de tre bedste VPN-tjenester, der også tilbyder gratis service ud over den betalte.
- Cyberghost VPN: En af de bedste VPN-software til rådighed på markedet lige nu. Du kan bruge denne service gratis på din pc, eller du kan betale et lille gebyr for premium versionen, der tilbyder endnu flere steder og hurtigere hastigheder end den gratis version. 1 års medlemskab koster 34, 99 dollar. Cyberghost arbejder på flere platforme.
- Hotspot Shield: En anden populær gratis VPN-software til din pc. Også tilgængelig på flere platforme og tilbyder fantastiske hastigheder selv på den gratis version. Ulempen ved at bruge den gratis version er, at du vil få annoncer under din browsing session. Elite-versionen koster dig $ 29, 95 pr. År.
- Spotflux VPN: En af de mest avancerede VPN'er til din pc. Spotflux gratis version giver dig adgang til alle de blokerede websites på internettet, men premium-versionen, der koster $ 37, 99 årligt, tilbyder adblokerende funktioner, højtydende placeringer, datakomprimering og mange flere funktioner.
Dette er alle de metoder, der giver dig mulighed for at fjerne blokering af blokerede websites på dit stationære eller bærbare computere. Men hvis du leder efter en måde at ophæve websteder på din Android-smartphone eller tablet, så fortsæt med at læse, fordi vi også har nogle tips til alle android-brugere.
Fjern blokering af websteder på Android-smartphones eller tablets
Det er endnu enklere at fjerne blokering af blokerede websites og indhold på en android-enhed. Hvis du vil fjerne blokering af websteder på din Android-smartphone eller -tablet, er alt du behøver at lave, hent en app fra Google Play Butik. Nedenfor er de top 3 apps, som vi anser bedst blandt alle andre VPN-apps, der er tilgængelige i Google Play Butik.
- Cyberghost: Ja, Cyberghost er også tilgængelig som en app til Android-platformen. Hvis du allerede har købt et premium-medlemskab til Cyberghost, så vil du være glad for at vide, at dit medlemskab også virker på Android-appen. Den gratis version af appen tilbyder også en stor samling af lokationer og servere at vælge imellem.
- Tunnel Bear VPN: Tunnel Bear VPN tilbyder de hurtigste gratis servere, du nogensinde vil opleve på en VPN app til Android. Datagrænsen for den gratis version er dog 1 GB. Så hvis du vil bruge det i vid udstrækning, så skal du måske bruge nogle penge til det betalte medlemskab.
- Hideninja VPN: Hvis du leder efter ubegrænset gratis data, bedre sikkerhed og hurtigere hastigheder, skal du downloade Hideninja VPN på din Android-enhed, fordi det tilbyder alt dette og endda nogle ekstra funktioner, der gør din browsing mere sikker. Forhindrer også dig fra onlinesporere, der implementeres af forskellige annoncører, for at lære mere om dig.
Fjern blokering af websteder på iOS-enheder (iPhone og iPad)
Bare rolig vores kære Apple fans, vi har ikke glemt dig. Vi har samlet de tre bedste VPN apps til iOS enheder. Hvis du har en iPhone eller en iPad eller måske begge disse enheder, kan du downloade en af disse apps til at blokere websteder på din iOS-enhed.
- Hotspot Shield: Hotspot Shield er tilbage igen. En af de bedste og gratis VPN-apps til rådighed for iOS-platformen. Du kan også købe premium versionen for at låse op for de ekstra funktioner i Hotspot Shield, men den gratis version tilbyder næsten alt, hvad du har brug for fra en VPN.
- VpnOneClick: Hvis du leder efter specifikke IP-adresser fra dine foretrukne lande, så kommer denne VPN-app meget praktisk. Den gratis version vil dog kun vare dig i et par dage, og så skal du betale for den betalte version, som koster $ 1, 99 pr. Måned.
- Spotflux: Spotflux er også tilgængelig på iOS-platformen, og hvis du allerede har købt premium-versionen af tjenesten, vil dit premium-medlemskab også overføre til iOS-enheden efter eget valg. Den gratis version giver stabile og hurtigere hastigheder, samtidig med at du beskyttes mod online trackers.
Dette er alle måder, hvorpå du kan fjerne blokering af blokerede websites på din desktop, laptop, iPhone, iPad eller Android-enhed. Hvis du løber ind i nogle problemer, mens du følger en af ovennævnte metoder, så lad os det vide ved at kommentere nedenfor.",['Basic'],"['a0585a5c-b72f-4c3a-a2a3-17e8e0b4ea4f'
 '85ac8d54-89c5-4473-95c4-797366f03cd0'
 '2668aa57-cdc3-4cac-8fa8-24b0a2475acd']",False,1.0,dan_Latn,dan_Latn,"[0, 1, 1, 1, 0]",True
